{
  "analysis_srid": 32719,
  "crs": "EPSG:4326",
  "dataset_id": "45d6996c-0148-53be-b5c8-f80b6434de98",
  "dataset_key": "I",
  "edges": [
    {
      "geometry": {
        "coordinates": [
          [
            -71.57971949585219,
            -33.08075864840655
          ],
          [
            -71.57950895183778,
            -33.07354977199262
          ]
        ],
        "type": "LineString"
      },
      "id": 3582613719966992,
      "natural_key": "arc:grid:32719:259200.000:6336800.000->grid:32719:259200.000:6337600.000",
      "physical_key": "corridor:grid:32719:259200.000:6336800.000|grid:32719:259200.000:6337600.000",
      "source": 7768945858957426996,
      "target": 440781798167006522
    },
    {
      "geometry": {
        "coordinates": [
          [
            -71.56280264957392,
            -33.08832100065068
          ],
          [
            -71.57136641963783,
            -33.08814455166929
          ]
        ],
        "type": "LineString"
      },
      "id": 190871578390325557,
      "natural_key": "arc:grid:32719:260800.000:6336000.000->grid:32719:260000.000:6336000.000",
      "physical_key": "corridor:grid:32719:260000.000:6336000.000|grid:32719:260800.000:6336000.000",
      "source": 1137868860172885945,
      "target": 2944321069771292226
    },
    {
      "geometry": {
        "coordinates": [
          [
            -71.57950895183778,
            -33.07354977199262
          ],
          [
            -71.58828241884363,
            -33.08058107321515
          ]
        ],
        "type": "LineString"
      },
      "id": 402636078931368836,
      "natural_key": "arc:grid:32719:259200.000:6337600.000->grid:32719:258400.000:6336800.000",
      "physical_key": "corridor:grid:32719:258400.000:6336800.000|grid:32719:259200.000:6337600.000",
      "source": 440781798167006522,
      "target": 7151068299201981365
    },
    {
      "geometry": {
        "coordinates": [
          [
            -71.57971949585219,
            -33.08075864840655
          ],
          [
            -71.57115649783164,
            -33.080935636371215
          ]
        ],
        "type": "LineString"
      },
      "id": 781151585012904969,
      "natural_key": "arc:grid:32719:259200.000:6336800.000->grid:32719:260000.000:6336800.000",
      "physical_key": "corridor:grid:32719:259200.000:6336800.000|grid:32719:260000.000:6336800.000",
      "source": 7768945858957426996,
      "target": 1918927165631179418
    },
    {
      "geometry": {
        "coordinates": [
          [
            -71.56280264957392,
            -33.08832100065068
          ],
          [
            -71.57157641625005,
            -33.09535345743648
          ]
        ],
        "type": "LineString"
      },
      "id": 903741281158018911,
      "natural_key": "arc:grid:32719:260800.000:6336000.000->grid:32719:260000.000:6335200.000",
      "physical_key": "corridor:grid:32719:260000.000:6335200.000|grid:32719:260800.000:6336000.000",
      "source": 1137868860172885945,
      "target": 697011380064398161
    },
    {
      "geometry": {
        "coordinates": [
          [
            -71.58849373509953,
            -33.087789891510134
          ],
          [
            -71.5799301148957,
            -33.08796751528331
          ]
        ],
        "type": "LineString"
      },
      "id": 1099418959939421529,
      "natural_key": "arc:grid:32719:258400.000:6336000.000->grid:32719:259200.000:6336000.000",
      "physical_key": "corridor:grid:32719:258400.000:6336000.000|grid:32719:259200.000:6336000.000",
      "source": 971869124324875616,
      "target": 6047320041077263199
    },
    {
      "geometry": {
        "coordinates": [
          [
            -71.57136641963783,
            -33.08814455166929
          ],
          [
            -71.5799301148957,
            -33.08796751528331
          ]
        ],
        "type": "LineString"
      },
      "id": 1132331550116927485,
      "natural_key": "arc:grid:32719:260000.000:6336000.000->grid:32719:259200.000:6336000.000",
      "physical_key": "corridor:grid:32719:259200.000:6336000.000|grid:32719:260000.000:6336000.000",
      "source": 2944321069771292226,
      "target": 6047320041077263199
    },
    {
      "geometry": {
        "coordinates": [
          [
            -71.57136641963783,
            -33.08814455166929
          ],
          [
            -71.57971949585219,
            -33.08075864840655
          ]
        ],
        "type": "LineString"
      },
      "id": 1151719156684594824,
      "natural_key": "arc:grid:32719:260000.000:6336000.000->grid:32719:259200.000:6336800.000",
      "physical_key": "corridor:grid:32719:259200.000:6336800.000|grid:32719:260000.000:6336000.000",
      "source": 2944321069771292226,
      "target": 7768945858957426996
    },
    {
      "geometry": {
        "coordinates": [
          [
            -71.57136641963783,
            -33.08814455166929
          ],
          [
            -71.57157641625005,
            -33.09535345743648
          ]
        ],
        "type": "LineString"
      },
      "id": 1166934160354898761,
      "natural_key": "arc:grid:32719:260000.000:6336000.000->grid:32719:260000.000:6335200.000",
      "physical_key": "corridor:grid:32719:260000.000:6335200.000|grid:32719:260000.000:6336000.000",
      "source": 2944321069771292226,
      "target": 697011380064398161
    },
    {
      "geometry": {
        "coordinates": [
          [
            -71.57157641625005,
            -33.09535345743648
          ],
          [
            -71.56301194867599,
            -33.09552995468644
          ]
        ],
        "type": "LineString"
      },
      "id": 1546728256084666912,
      "natural_key": "arc:grid:32719:260000.000:6335200.000->grid:32719:260800.000:6335200.000",
      "physical_key": "corridor:grid:32719:260000.000:6335200.000|grid:32719:260800.000:6335200.000",
      "source": 697011380064398161,
      "target": 4995972834329500172
    },
    {
      "geometry": {
        "coordinates": [
          [
            -71.57971949585219,
            -33.08075864840655
          ],
          [
            -71.57136641963783,
            -33.08814455166929
          ]
        ],
        "type": "LineString"
      },
      "id": 1587313241393798898,
      "natural_key": "arc:grid:32719:259200.000:6336800.000->grid:32719:260000.000:6336000.000",
      "physical_key": "corridor:grid:32719:259200.000:6336800.000|grid:32719:260000.000:6336000.000",
      "source": 7768945858957426996,
      "target": 2944321069771292226
    },
    {
      "geometry": {
        "coordinates": [
          [
            -71.56301194867599,
            -33.09552995468644
          ],
          [
            -71.56280264957392,
            -33.08832100065068
          ]
        ],
        "type": "LineString"
      },
      "id": 2279962038679541020,
      "natural_key": "arc:grid:32719:260800.000:6335200.000->grid:32719:260800.000:6336000.000",
      "physical_key": "corridor:grid:32719:260800.000:6335200.000|grid:32719:260800.000:6336000.000",
      "source": 4995972834329500172,
      "target": 1137868860172885945
    },
    {
      "geometry": {
        "coordinates": [
          [
            -71.57115649783164,
            -33.080935636371215
          ],
          [
            -71.57971949585219,
            -33.08075864840655
          ]
        ],
        "type": "LineString"
      },
      "id": 2342277924299156905,
      "natural_key": "arc:grid:32719:260000.000:6336800.000->grid:32719:259200.000:6336800.000",
      "physical_key": "corridor:grid:32719:259200.000:6336800.000|grid:32719:260000.000:6336800.000",
      "source": 1918927165631179418,
      "target": 7768945858957426996
    },
    {
      "geometry": {
        "coordinates": [
          [
            -71.57136641963783,
            -33.08814455166929
          ],
          [
            -71.56280264957392,
            -33.08832100065068
          ]
        ],
        "type": "LineString"
      },
      "id": 2453621888376858537,
      "natural_key": "arc:grid:32719:260000.000:6336000.000->grid:32719:260800.000:6336000.000",
      "physical_key": "corridor:grid:32719:260000.000:6336000.000|grid:32719:260800.000:6336000.000",
      "source": 2944321069771292226,
      "target": 1137868860172885945
    },
    {
      "geometry": {
        "coordinates": [
          [
            -71.57115649783164,
            -33.080935636371215
          ],
          [
            -71.56280264957392,
            -33.08832100065068
          ]
        ],
        "type": "LineString"
      },
      "id": 2608382830503931053,
      "natural_key": "arc:grid:32719:260000.000:6336800.000->grid:32719:260800.000:6336000.000",
      "physical_key": "corridor:grid:32719:260000.000:6336800.000|grid:32719:260800.000:6336000.000",
      "source": 1918927165631179418,
      "target": 1137868860172885945
    },
    {
      "geometry": {
        "coordinates": [
          [
            -71.58849373509953,
            -33.087789891510134
          ],
          [
            -71.57971949585219,
            -33.08075864840655
          ]
        ],
        "type": "LineString"
      },
      "id": 2695021165066563276,
      "natural_key": "arc:grid:32719:258400.000:6336000.000->grid:32719:259200.000:6336800.000",
      "physical_key": "corridor:grid:32719:258400.000:6336000.000|grid:32719:259200.000:6336800.000",
      "source": 971869124324875616,
      "target": 7768945858957426996
    },
    {
      "geometry": {
        "coordinates": [
          [
            -71.56280264957392,
            -33.08832100065068
          ],
          [
            -71.57115649783164,
            -33.080935636371215
          ]
        ],
        "type": "LineString"
      },
      "id": 2810064842642167546,
      "natural_key": "arc:grid:32719:260800.000:6336000.000->grid:32719:260000.000:6336800.000",